[
  {
    "id": "person_koppermann_hj_1917",
    "type": "Person",
    "pref_label": "Hans-Jürgen Koppermann",
    "alt_labels": ["Hans Koppermann"],
    "family_name": "Koppermann",
    "given_name": "Hans-Jürgen",
    "birth_date": "1917-09-02",
    "birth_place": "Hannover",
    "death_date": null,
    "branch": null,
    "unit_type": null,
    "heimatgarnison": null,
    "wehrkreis": null,
    "parent_unit_id": null,
    "notes": "Erkennungsmarke: -42- / 1/N.20. Lt. d.R. ab 1944-11-09. Als vermisst gemeldet 1945-01-13, Weichselbogen. Familienüberlieferung: Beinverlust.",
    "created_at": "2026-06-11"
  },
  {
    "id": "unit_na20",
    "type": "MilitaryUnit",
    "pref_label": "Nachrichten-Abteilung 20",
    "alt_labels": ["N.A. 20", "Nachr.Abt. 20", "1. Kp. N.A. 20"],
    "abbr": "N.A. 20",
    "branch": "Heer",
    "unit_type": "Abteilung",
    "heimatgarnison": "Hamburg-Wandsbek",
    "wehrkreis": "X",
    "parent_unit_id": "unit_20_inf_div_mot",
    "family_name": null,
    "given_name": null,
    "birth_date": null,
    "death_date": null,
    "birth_place": null,
    "notes": "Divisionstruppe 20. Inf.Div.(mot.) / 20. Pz.Gren.Div. Tessin Bd. 4, S. 155. Koppermann 1939 und 1942 belegt.",
    "created_at": "2026-06-11"
  },
  {
    "id": "unit_nea20",
    "type": "MilitaryUnit",
    "pref_label": "Nachrichten-Ersatz-Abteilung 20",
    "alt_labels": ["N.E.A. 20", "Nachr.Ers.Abt. 20", "Stmkp. N.E.A. 20"],
    "abbr": "N.E.A. 20",
    "branch": "Heer",
    "unit_type": "Abteilung",
    "heimatgarnison": "Hamburg",
    "wehrkreis": "X",
    "family_name": null,
    "given_name": null,
    "birth_date": null,
    "death_date": null,
    "birth_place": null,
    "notes": "Ersatz- und Ausbildungsabteilung WK X. Ab 01.10.1942 geteilt in Ers.Abt. und Ausb.Abt. Koppermann 1942: Stamm-Kp. und Genesenden-Kp.",
    "created_at": "2026-06-11"
  },
  {
    "id": "unit_20_inf_div_mot",
    "type": "MilitaryUnit",
    "pref_label": "20. Infanterie-Division (motorisiert)",
    "alt_labels": ["20. Inf.Div.(mot)", "20. Inf. Div. (mot.)", "20. Inf.-Div.(mot.)"],
    "abbr": "20. Inf.Div.(mot)",
    "branch": "Heer",
    "unit_type": "Division",
    "family_name": null,
    "given_name": null,
    "birth_date": null,
    "death_date": null,
    "birth_place": null,
    "notes": "Umbenannt am 23.06.1943 in 20. Panzergrenadier-Division. Tessin Bd. 4, S. 133–135.",
    "created_at": "2026-06-11"
  },
  {
    "id": "unit_pzgrenrgt90",
    "type": "MilitaryUnit",
    "pref_label": "Panzergrenadier-Regiment 90",
    "alt_labels": ["Grenadier-Regiment 90", "Gr.R. 90", "Infanterie-Regiment 90", "I.R. 90", "Pz.Gren.Rgt. 90", "Inf.Rgt.(mot.) 90"],
    "abbr": "Pz.Gren.Rgt. 90",
    "branch": "Heer",
    "unit_type": "Regiment",
    "heimatgarnison": "Hamburg-Wentorf",
    "wehrkreis": "X",
    "parent_unit_id": "unit_20_pz_gren_div",
    "family_name": null,
    "given_name": null,
    "birth_date": null,
    "death_date": null,
    "birth_place": null,
    "notes": "Früher I.R. 90 / Gr.R. 90. Umbenennung parallel mit Division 23.06.1943. Koppermann: 11./Gr.R.90 → 9./Pz.Gr.B.90. Tessin Bd. 4, S. 145–146.",
    "created_at": "2026-06-11"
  },
  {
    "id": "unit_20_pz_gren_div",
    "type": "MilitaryUnit",
    "pref_label": "20. Panzergrenadier-Division",
    "alt_labels": ["20. Pz. Gren. Div.", "20. Pz.Gren.Div.", "20. Panzergrenadier-Division"],
    "abbr": "20. Pz.Gren.Div.",
    "branch": "Heer",
    "unit_type": "Division",
    "family_name": null,
    "given_name": null,
    "birth_date": null,
    "death_date": null,
    "birth_place": null,
    "notes": "Umbenannt aus 20. Inf.Div.(mot.) am 23.06.1943. Tessin Bd. 4, S. 133–135. Weichselbogen Jan. 1945 (Hgr. A).",
    "created_at": "2026-06-11"
  }
]
